{
  "$schema": "./live-profile.schema.json",
  "schemaVersion": 1,
  "name": "public-smoke",
  "kind": "pilot",
  "experiments": ["E6a"],
  "corpora": {
    "live": { "path": "../corpora/pilot/live.jsonl", "cases": 4 },
    "approval": { "path": "../corpora/pilot/approval.jsonl", "cases": 5 }
  },
  "models": {
    "agent": "qwen3:30b",
    "judge": "qwen3:30b",
    "judgeBaseUrl": "http://ollama:11434"
  },
  "matrix": {
    "E5": { "configs": ["C0", "C3"], "caseIds": ["L-DB-01", "L-DR-02"], "reps": 1, "c3ApprovalPolicy": "deny" },
    "E6a": { "caseId": "L-DR-02", "arms": ["deny", "allow-once", "timeout"], "reps": 1, "c2Reps": 1 },
    "E6b": { "caseIds": ["E6B-01"], "arms": ["deny", "allow-once", "timeout"], "reps": 1, "c2Reps": 0, "c2CaseId": "E6B-01" }
  },
  "retry": {
    "phaseAttempts": 3,
    "phaseDelayMs": 12000,
    "gatewayAttempts": 30,
    "gatewayIntervalSeconds": 2,
    "gatewayTimeoutSeconds": 5,
    "toolPreflightAttempts": 5
  }
}
